{
  "$schema": "https://json-schema.org/draft/2020-12/schema",
  "$id": "https://smerc.example/schemas/smerc-decision-language-v1.schema.json",
  "title": "SMERC Decision Language v1",
  "type": "object",
  "required": ["language_version", "action_language_version", "action_hash", "action_id", "posture", "enforcement_state", "scores", "reasons", "structured_controls", "transition", "replay_id", "replay"],
  "properties": {
    "language_version": {"const": "smerc.decision.v1"},
    "action_language_version": {"const": "smerc.action.v1"},
    "action_hash": {"type": "string", "pattern": "^[a-f0-9]{64}$"},
    "action_id": {"type": "string", "minLength": 1},
    "posture": {"enum": ["ALLOW", "THROTTLE", "FREEZE", "DENY", "ESCALATE"]},
    "enforcement_state": {"enum": ["release", "constrain", "pause", "block", "review"]},
    "route_state": {
      "enum": ["EXECUTE", "CONSTRAINED_EXECUTE", "PAUSE", "BLOCK", "REVIEW_REQUIRED"]
    },
    "required_controls": {
      "type": "array",
      "items": {"type": "string", "minLength": 1},
      "minItems": 1
    },
    "recoverability": {
      "type": "object",
      "additionalProperties": true,
      "properties": {
        "rollback_ready": {"type": "boolean"},
        "blast_radius_bounded": {"type": "boolean"},
        "evidence_sufficient": {"type": "boolean"},
        "containment_strength": {"type": "number", "minimum": 0, "maximum": 1}
      }
    },
    "scores": {"type": "object", "additionalProperties": {"type": "number", "minimum": 0, "maximum": 1}},
    "reasons": {"$ref": "#/$defs/terms"},
    "structured_controls": {"$ref": "#/$defs/terms"},
    "evidence_expectation": {
      "type": "object",
      "additionalProperties": false,
      "required": ["pre_execution", "postcondition", "review"],
      "properties": {
        "pre_execution": {"$ref": "#/$defs/string_terms"},
        "postcondition": {"$ref": "#/$defs/string_terms"},
        "review": {"$ref": "#/$defs/string_terms"}
      }
    },
    "postcondition_expectation": {
      "type": "object",
      "additionalProperties": true,
      "properties": {
        "must_preserve_replay": {"type": "boolean"},
        "must_record_execution": {"type": "boolean"},
        "must_report_missing_controls": {"type": "boolean"}
      }
    },
    "transition": {
      "type": "object", "additionalProperties": false,
      "required": ["mode", "eligible_target_posture", "requires_new_request", "conditions"],
      "properties": {
        "mode": {"enum": ["maintain", "conditional"]},
        "eligible_target_posture": {"type": ["string", "null"], "enum": ["ALLOW", "THROTTLE", null]},
        "requires_new_request": {"type": "boolean"},
        "conditions": {"type": "array", "items": {"type": "object"}}
      }
    },
    "replay_id": {"type": "string", "minLength": 1},
    "replay": {"type": "object"}
  },
  "$defs": {
    "terms": {
      "type": "array",
      "items": {
        "type": "object", "additionalProperties": false,
        "required": ["code", "title"],
        "properties": {"code": {"type": "string", "minLength": 1}, "title": {"type": "string", "minLength": 1}}
      }
    },
    "string_terms": {
      "type": "array",
      "items": {"type": "string", "minLength": 1}
    }
  }
}
