{
  "action_hash": "32634cb89ea1ca3d827fd934a782f16e87f89ac174ee0956d739bf5e47dffb72",
  "action_id": "external-framework-cloud-change-001",
  "action_language_version": "smerc.action.v1",
  "enforcement_state": "constrain",
  "evidence_expectation": {
    "postcondition": [
      "record_execution_report",
      "preserve_replay"
    ],
    "pre_execution": [
      "preview_before_execution",
      "checkpoint_before_execution",
      "require_rollback_plan"
    ],
    "review": []
  },
  "language_version": "smerc.decision.v1",
  "postcondition_expectation": {
    "must_preserve_replay": true,
    "must_record_execution": true,
    "must_report_missing_controls": true
  },
  "posture": "THROTTLE",
  "reasons": [
    {
      "code": "IRREVERSIBLE_EXPOSURE_ELEVATED",
      "title": "Irreversible Exposure Elevated"
    },
    {
      "code": "EVIDENCE_VALIDITY_LOW",
      "title": "Evidence Validity Low"
    }
  ],
  "recoverability": {
    "blast_radius_bounded": true,
    "containment_strength": 0.76,
    "evidence_sufficient": false,
    "rollback_ready": true
  },
  "replay": {
    "emitter_version": "smerc.decision-language-emitter.v1",
    "source_framework": "example-agent-orchestrator",
    "summary": "Agent proposes increasing regional compute capacity while task completion certainty is low."
  },
  "replay_id": "external-framework-cloud-change-001:smerc-decision-language",
  "required_controls": [
    "checkpoint_before_execution",
    "limit_scope",
    "preserve_replay",
    "preview_before_execution",
    "record_execution_report",
    "require_rollback_plan"
  ],
  "route_state": "CONSTRAINED_EXECUTE",
  "scores": {
    "authorization_confidence": 0.82,
    "irreversible_exposure": 0.58,
    "reversible_capacity": 0.71
  },
  "structured_controls": [
    {
      "code": "checkpoint_before_execution",
      "title": "Checkpoint Before Execution"
    },
    {
      "code": "limit_scope",
      "title": "Limit Scope"
    },
    {
      "code": "preserve_replay",
      "title": "Preserve Replay"
    },
    {
      "code": "preview_before_execution",
      "title": "Preview Before Execution"
    },
    {
      "code": "record_execution_report",
      "title": "Record Execution Report"
    },
    {
      "code": "require_rollback_plan",
      "title": "Require Rollback Plan"
    }
  ],
  "transition": {
    "conditions": [
      {
        "code": "EVIDENCE_AND_RECOVERY_READY",
        "description": "Restore evidence, rollback, and containment conditions before relaxing posture.",
        "field": "recoverability",
        "operator": "restored",
        "value": true
      }
    ],
    "eligible_target_posture": "ALLOW",
    "mode": "conditional",
    "requires_new_request": false
  }
}
